{
  "$schema": "./schemas/design-requirements-ledger.schema.json",
  "schemaVersion": "oluk.design-requirements-ledger.v1",
  "status": "REFERENCE_ONLY_PINNED",
  "authorityPin": {
    "document": "DESIGN-AUTHORITY-PIN.md",
    "runtimeContractId": "OLUK_RUNTIME_CONSUMPTION_REGISTRY_V1",
    "runtimeContractVersion": "1.0.0"
  },
  "sourcePins": {
    "programmeAmendmentSha256": "f33b2713377160b46b84151dd52f71415393d341ebcf452b6e7c316a5e192ca0",
    "runtimeContractSha256": "7aa1f4cfc02d441d672626067ab65979c3c7184f73dfe545322e43e14899154c",
    "legacyDispositionRegistrySha256": "ece13e6003a615caed395186f9ce547a7d06bf17bc607eead48f40d760c29458"
  },
  "requirements": [
    {
      "requirementId": "DSR-001",
      "kind": "component",
      "name": "ProductCommerceCard",
      "componentOwner": "OLUK Design System / commerce components",
      "surfaceContexts": [
        "product discovery",
        "product relation",
        "product promotion"
      ],
      "contractRef": {
        "contractId": "OLUK_RUNTIME_CONSUMPTION_REGISTRY_V1",
        "version": "1.0.0"
      },
      "fieldRefs": [
        {
          "fieldId": "product.canonicalProductId",
          "necessity": "required",
          "missingBehavior": {
            "mode": "suppress-component",
            "requirement": "Do not render an addressable commerce card without canonical product identity."
          }
        },
        {
          "fieldId": "product.canonicalSku",
          "necessity": "optional",
          "missingBehavior": {
            "mode": "omit-element",
            "requirement": "Omit the SKU element without inventing a label or deriving identity."
          }
        },
        {
          "fieldId": "product.customerName",
          "necessity": "required",
          "missingBehavior": {
            "mode": "suppress-component",
            "requirement": "Do not substitute a fixture or catalogue alias for the customer-facing name."
          }
        },
        {
          "fieldId": "commerce.price.amountMinor",
          "necessity": "required",
          "missingBehavior": {
            "mode": "render-unavailable",
            "requirement": "Keep the product identifiable but remove purchase affordance and present a non-priced unavailable treatment."
          }
        },
        {
          "fieldId": "commerce.price.currency",
          "necessity": "required",
          "missingBehavior": {
            "mode": "render-unavailable",
            "requirement": "Do not format or infer a currency; remove purchase affordance with the price."
          }
        },
        {
          "fieldId": "commerce.availability.state",
          "necessity": "required",
          "missingBehavior": {
            "mode": "render-unavailable",
            "requirement": "Use the neutral unavailable presentation and do not infer availability from quantity or price."
          }
        },
        {
          "fieldId": "commerce.purchasability.state",
          "necessity": "required",
          "missingBehavior": {
            "mode": "disable-interaction",
            "requirement": "Disable the purchase action without deriving purchasability from any other field."
          }
        },
        {
          "fieldId": "commerce.quantity.minimum",
          "necessity": "optional",
          "missingBehavior": {
            "mode": "omit-element",
            "requirement": "Omit quantity controls that require a minimum and leave quantity choice to the owning host."
          }
        },
        {
          "fieldId": "commerce.quantity.maximum",
          "necessity": "optional",
          "missingBehavior": {
            "mode": "omit-element",
            "requirement": "Do not expose an unconstrained quantity control when the maximum is absent."
          }
        },
        {
          "fieldId": "commerce.quantity.step",
          "necessity": "optional",
          "missingBehavior": {
            "mode": "omit-element",
            "requirement": "Do not assume a step; omit the local quantity control."
          }
        },
        {
          "fieldId": "media.primary.handle",
          "necessity": "optional",
          "missingBehavior": {
            "mode": "preserve-layout-without-value",
            "requirement": "Preserve the authored media region as intentionally unpopulated without substituting another product render."
          }
        }
      ],
      "variants": [
        {
          "id": "discovery",
          "requirement": "Support repeated product discovery without changing field ownership or inventing missing commerce truth."
        },
        {
          "id": "relation",
          "requirement": "Support a related-product context while preserving the same identity and commerce reference obligations."
        },
        {
          "id": "featured",
          "requirement": "Support single-product emphasis without gaining additional runtime fields or mutation authority."
        }
      ],
      "stateObligations": [
        {
          "id": "data-complete",
          "requirement": "Expose the runtime-projected identity, price, availability, and purchasability without local derivation."
        },
        {
          "id": "commerce-unavailable",
          "requirement": "Keep identity readable, remove purchase affordance, and avoid optimistic stock or price presentation."
        },
        {
          "id": "interaction-disabled",
          "requirement": "Show the purchase action as unavailable and preserve a programmatic explanation supplied by the host."
        },
        {
          "id": "media-missing",
          "requirement": "Retain coherent structure without substituting unregistered media."
        }
      ],
      "responsiveObligations": [
        {
          "id": "wide",
          "requirement": "Permit media, facts, status, price, and action to coexist without changing reading order."
        },
        {
          "id": "compact",
          "requirement": "Reflow to one product decision at a time with identity and status before the purchase action."
        },
        {
          "id": "content-stress",
          "requirement": "Wrap customer names and localized price output without collision, clipping, or action displacement."
        }
      ],
      "accessibilityObligations": [
        {
          "id": "semantic-group",
          "requirement": "Expose one coherent product group with an unambiguous accessible name."
        },
        {
          "id": "focus-order",
          "requirement": "Keep focus order aligned with identity, supporting link, quantity if present, and purchase action."
        },
        {
          "id": "non-color-status",
          "requirement": "Communicate availability and disabled action state with text or semantics in addition to color."
        },
        {
          "id": "image-alternative",
          "requirement": "Treat the registered product media as informative or decorative consistently with the host context."
        }
      ],
      "forbiddenBehaviors": [
        "Do not format amountMinor without the referenced currency.",
        "Do not infer availability or purchasability from price, media, quantity, or historical fixtures.",
        "Do not perform commerce mutation from the component.",
        "Do not branch presentation by provider identity."
      ]
    },
    {
      "requirementId": "DSR-002",
      "kind": "surface",
      "name": "Shipping choice",
      "componentOwner": "OLUK Design System / checkout choice surfaces",
      "surfaceContexts": [
        "checkout shipping selection"
      ],
      "contractRef": {
        "contractId": "OLUK_RUNTIME_CONSUMPTION_REGISTRY_V1",
        "version": "1.0.0"
      },
      "fieldRefs": [
        {
          "fieldId": "shipping.options[].shippingOptionId",
          "necessity": "required",
          "missingBehavior": {
            "mode": "suppress-item",
            "requirement": "Do not render or select a shipping option without runtime identity."
          }
        },
        {
          "fieldId": "shipping.options[].label",
          "necessity": "required",
          "missingBehavior": {
            "mode": "suppress-item",
            "requirement": "Do not invent a customer label for an unidentified choice."
          }
        },
        {
          "fieldId": "shipping.options[].amountMinor",
          "necessity": "required",
          "missingBehavior": {
            "mode": "render-unavailable",
            "requirement": "Keep the option non-selectable and do not infer a free or estimated amount."
          }
        },
        {
          "fieldId": "shipping.options[].currency",
          "necessity": "required",
          "missingBehavior": {
            "mode": "render-unavailable",
            "requirement": "Do not format the amount or allow selection without its currency."
          }
        },
        {
          "fieldId": "shipping.options[].eligible",
          "necessity": "required",
          "missingBehavior": {
            "mode": "disable-interaction",
            "requirement": "Treat eligibility as unresolved; do not infer it from the option's presence."
          }
        },
        {
          "fieldId": "shipping.options[].selected",
          "necessity": "required",
          "missingBehavior": {
            "mode": "disable-interaction",
            "requirement": "Do not create a local default selection or continue with an assumed option."
          }
        }
      ],
      "variants": [
        {
          "id": "single-choice",
          "requirement": "Present the sole runtime option without implying that Design selected it."
        },
        {
          "id": "multiple-choice",
          "requirement": "Present mutually exclusive runtime choices with stable option identity."
        }
      ],
      "stateObligations": [
        {
          "id": "choice-ready",